### ISSUE TITLE
ReadPacketDate reads a jumbo packet, but WritePacketData writes two smaller sequential packets

### ISSUE THREAD

**Issue by iamlimitless** [google/gopacket#142]
Sorry in advance if this is the wrong place to raise this issue.

I have written a simple reader/writer program that writes to a network interface, and reads off of a connected interface and calculates the number of packets sent. (This is implemented using separate Go routines). However my write count is sometimes greater than my read count. Investigating this issue using tcpdump showed that large packets are being written as two packets (sequence # 0:1448, 1448:2896), but are sometimes read in as one large packet(0:2896). The behavior is occurs often but appears to be random (ie not all packets follow the same behavior). 

Here is the tcpdump of me repeatedly sending the same two packets until it occurs. 

tcpdump on the reader's interface

16:52:07.855234 IP 74.125.174.140.http > 192.168.1.64.52519: Flags [.], seq 0:1448, ack 1, win 238, options [nop,nop,TS val 829523941 ecr 1466196712], length 1448
16:52:07.855242 IP 74.125.174.140.http > 192.168.1.64.52519: Flags [.], seq 1448:2896, ack 1, win 238, options [nop,nop,TS val 829523941 ecr 1466196712], length 1448
16:52:07.855283 IP 74.125.174.140.http > 192.168.1.64.52519: Flags [.], seq 0:1448, ack 1, win 238, options [nop,nop,TS val 829523941 ecr 1466196712], length 1448
16:52:07.855413 IP 74.125.174.140.http > 192.168.1.64.52519: Flags [.], seq 1448:2896, ack 1, win 238, options [nop,nop,TS val 829523941 ecr 1466196712], length 1448
16:52:07.855421 IP 74.125.174.140.http > 192.168.1.64.52519: Flags [.], seq 0:2896, ack 1, win 238, options [nop,nop,TS val 829523941 ecr 1466196712], length 2896
16:52:07.855426 IP 74.125.174.140.http > 192.168.1.64.52519: Flags [.], seq 0:2896, ack 1, win 238, options [nop,nop,TS val 829523941 ecr 1466196712], length 2896

tcpdump on the writer interface

16:52:07.855036 IP 74.125.174.140.http > 192.168.1.64.52519: Flags [.], seq 0:1448, ack 1, win 238, options [nop,nop,TS val 829523941 ecr 1466196712], length 1448
16:52:07.855081 IP 74.125.174.140.http > 192.168.1.64.52519: Flags [.], seq 1448:2896, ack 1, win 238, options [nop,nop,TS val 829523941 ecr 1466196712], length 1448
16:52:07.855126 IP 74.125.174.140.http > 192.168.1.64.52519: Flags [.], seq 0:1448, ack 1, win 238, options [nop,nop,TS val 829523941 ecr 1466196712], length 1448
16:52:07.855169 IP 74.125.174.140.http > 192.168.1.64.52519: Flags [.], seq 1448:2896, ack 1, win 238, options [nop,nop,TS val 829523941 ecr 1466196712], length 1448
16:52:07.855213 IP 74.125.174.140.http > 192.168.1.64.52519: Flags [.], seq 0:1448, ack 1, win 238, options [nop,nop,TS val 829523941 ecr 1466196712], length 1448
16:52:07.855246 IP 74.125.174.140.http > 192.168.1.64.52519: Flags [.], seq 1448:2896, ack 1, win 238, options [nop,nop,TS val 829523941 ecr 1466196712], length 1448
16:52:07.855281 IP 74.125.174.140.http > 192.168.1.64.52519: Flags [.], seq 0:1448, ack 1, win 238, options [nop,nop,TS val 829523941 ecr 1466196712], length 1448
16:52:07.855305 IP 74.125.174.140.http > 192.168.1.64.52519: Flags [.], seq 1448:2896, ack 1, win 238, options [nop,nop,TS val 829523941 ecr 1466196712], length 1448

Thank you very much for your assistance.

**Comment by iamlimitless** [comment]
Sorry about this, the issue was due to the network card de-fragmenting the packets due to General-Receive-Offloading being enabled.
